Name,Phone,Rating,Rating Count,Address
Young Man & Company,+(91)-9152311377,4.0,44,"Shop No. 888-890, Main Road, Nai Sarak, Chandni Chowk, Delhi - 110006, Near Town Hall"
Bindal Gallery,+(91)-9152872001,3.7,17,"A-2/6, Noida Sector 110, Noida - 201305, Noida"
Kriti Creations Kritiwala,+(91)-124-4554968,3.5,2,"157,158 Good Earth City Centre, Sector 50, Gurgaon - 122001"
Kriti Creations,+(91)-9152586992,4.2,309,"110, Rajouri Garden, Delhi - 110027, Near Biba Showroom"
Craft Creations,+(91)-11-47537174,5.0,8,"Plot no-87, pocket -C-7, sec 7&8 dividing road, Rohini Sector 7, Delhi - 110085, Near Sai baba chowk"
Surprising Craft,+(91)-9899099997,5.0,4,"D Block, 176,, Kamla Nagar, Delhi - 110007, Nr- Brijwasi Sweet"
Delhi Haat.,+(91)-11-65871843,4.3,25,"55., Nehru Bazar., Panchkuian Road, Delhi - 110001, Metro Pillar No 6"
Camel Art Centre,+(91)-11-24332969,4.3,37,"Shop Number A - 263, Basement, Main Road, Bhisham Pitamah Marg, Defence Colony, Delhi - 110024, Near State Bank Of India"
Itsy Bitsy Pvt. Ltd.,+(91)-8826688637,4.2,138,"C 20, Ground Floor, Lajpat Nagar 2, Delhi - 110024, Near CCD"
Archies Gift Gallery,+(91)-9958710701,4.2,20,"Shop No-3-4, Crescent Square Mall, Rohini Sector 9, Delhi - 110085, D C Chowk"
Rama Stationery Mart,+(91)-11-29965979,4.2,15,"40 / 1361, Dda Flats, Madangir, Delhi - 110062, Near Sainik Farms"
The Craft Gallery,+(91)-120-4222646,4.2,21,"Shop Number 344, First Floor, Sector 61, Noida - 201307, Near Shopprix Mall"
Trends,+(91)-11-25170525,4.1,17,"2b/77, Ramesh Nagar, Delhi - 110015, Near Post Office"
Itsy Bitsy,+(91)-11-47513475,4.0,44,"QP-63, 0, Pitampura, Delhi - 110034, Near Gopal Mandir"
Rajesh Gifts & Stationers,+(91)-9818167672,4.0,19,"D-12/35, Rohini Sector 7, Delhi - 110085, Near Metro Pillar No-409"
Kashmir Government Arts Emp..,+(91)-11-23364723,4.0,90,"A-7, State Emphoria Complex, Baba Kharak Singh Marg, Connaught Place, Delhi - 110001"
Ganga Ram Amar Nath & Sons,+(91)-11-23675375,3.8,9,"5030, RUI Mandi, Sadar Bazar, Delhi - 110006, Nr West End Cinema"
Hamleys,+(91)-11-45613062,4.5,2,"Reliance Lifestyle Holdings Ltd, Unit No DA 01, IGI Airport, Delhi - 110037, Domestic Arrival, Baggage Belt Area, Terminal 3"
Novelty House,+(91)-11-23670966,3.3,8,"6071/B, Qutub Road Chowk, Sadar Bazar, Delhi - 110006, Bari Market"
Jindal Crafts,+(91)-9811152840,3.7,10,"D 963, 60 Feet Road, Chawla Colony, Ballabhgarh, Faridabad - 121004"
Geeta Variety Store,+(91)-9582065748,4.2,6,"50-A/9, Sec-7 naharpur, Rohini Sector 7, Delhi - 110085, Near pnb bank"
Gearup Online Retail Servic..,+(91)-9152896883,4.5,2,"CE-3, GROUND FLOOR, HARI NAGAR CLOCK TOWER NEW DELHI, Hari Nagar, Delhi - 110064, HARI NAGAR CLOCK TOWER"
Handicrafts & Handloom Expo..,+(91)-11-23701132,4.8,2,"1, Jawahar Vyapar Bhawan, Tolstoy Marg, New Delhi, Delhi - 110001"
Sehgal Craft,+(91)-9971128795,4.5,4,"Shop No -2, GD Market, Pitampura, Delhi - 110034, Near Pitampura Metro Station"
My Pet Hub,+(91)-9582123886,4.5,2,"12 E, 0, Dhaka Village, Delhi - 110009, Near Kingsway Camp"
Banaras handicraft,+(91)-9871291543,4.5,6,"4826., 6 khoti chowk, Pahar Ganj, Delhi - 110055, Main Bazar"
Saini Stone Kala Kendra And..,+(91)-9891198673,4.5,2,"Shop Number 3, Matta Road, Gurgaon - 122001, Near Lalit Marbles"
Mehra Bros,+(91)-11-24656477,4.5,2,"27-B,, Main Road, Khan Market, Delhi - 110003, Near By Bank Of India"
B D Handicrafts Emporium,+(91)-8750384843,3.8,5,"Shop Number- 5084, Pahar Ganj, Delhi - 110055, Opposite Anoop Hotel,Main Market"
Madan Traceres,+(91)-11-25765847,2.4,5,"F-- 102, 1st -Floor, Karol Bagh, Delhi - 110005, Ghaffar Market"
Rishav Handicraft,+(91)-11-28727121,4.7,5,"30/3232, Sarswati Road, Karol Bagh, Delhi - 110005, Near Karol Bagh Church, Beadon Pura"
Jagjit Sons,+(91)-9560954544,4.6,4,"Shop Number-33, Vasant Kunj, Delhi - 110070, Nathu Singh Market,Opposite Central Market"
MB Traders,+(91)-9899466506,4.8,5,"WZ-141, Gali No-2, Sri Nagar-Shakur Basti, Delhi - 110034, Near gurudwara"
OM EXPO,+(91)-9811088086,4.0,1,"1583, Main Bazar, Pahar Ganj, Delhi - 110055, near Vishal Guest House"
Akal Purakh Handicraft,+(91)-11-65159325,3.0,2,"Shop No 1191, Pahar Ganj, Delhi - 110055, Main Bazar,Near Hotel Vivek & 6 Tooti Chowk"
Zahura Enterprises,+(91)-11-23253696,4.3,3,"2264 Zahuri Market, Turkmaan Gate, Asaf Ali Road, Delhi - 110002"
Shabnam Crafts,+(91)-11-65470146,1.0,1,"A-62, Bapu park, Kotla Mubarakpur, Delhi - 110003, Main market,near moti hostel"
Any Occasion The Gift Shop,+(91)-8860422402,4.9,7,"Shop no-74/5,FF, Main market, Yusuf Sarai-Green Park, Delhi - 110016, Near metro station"
Kanishka Trophy,+(91)-9899072530,3.5,1,"X/718, Chand Mohalla, Gandhi Nagar, Delhi - 110031, Kite Mkt,Raghuver Pura No -1"
SIM Consultancy Service Pvt..,+(91)-8295269332,5.0,1,"Plot No 30,  Village SInghu, Narela City, KHSNO #2D, Near Medical Dispensary, Narela, Delhi - 110040, SInghu Border"
Aggarwal Packaging,+(91)-11-32945050,5.0,1,"Plot Number-16, Main Loni Road, Johripur, Delhi - 110094, Near Sarvodya Dharam Kanta, Jawahar Nagar"
Craft Hut,+(91)-9412840456,4.0,1,"shop no-UGF-15, Vaibhav khand, Indirapuram, Ghaziabad - 201014, Express garden"
Gift Cart,+(91)-9811020098,5.0,1,"Shop No 214/8, Gift Wali Gali,Main Market Old, Faridabad - 121002, Near Bajaj Sweets"
Hamleys,+(91)-11-40517130,0.0,0,"A-3, P-1B, Select City Walk Mall, Saket, Delhi - 110017, District Centre"
Dip Craft Industries,+(91)-11-25475259,0.0,0,"A6 Yadav Park, Dip Craft Industrie, Kamruddin Road , Kamruddin Road, Nangloi, Delhi - 110041"
Nagpal Stationers,+(91)-11-30518355,3.5,2,"2604, Nai Sarak, Delhi - 110006, Balaji Market"
Mohan Sons,+(91)-9810204048,3.7,3,"A 106, Near D Park, Pandav Nagar, Delhi - 110092, OPP  Main MOTHER DAIRY"
New Lovely Tracer,+(91)-9654547540,3.4,5,"Shop Number-5/1/36, Mall Road, Tilak Nagar, Delhi - 110018, near kumar sons Near Behind Guru Charan Jeweller"
Hamleys,+(91)-11-43619233,0.0,0,"Unit No C04-05, IGI Airport, Delhi - 110037, Meet & Greet Area  Arrivals, Terminal 1"
R K Oswal,+(91)-9312842138,4.0,2,"479 Ist Floor, Sadar Bazar, Delhi - 110006, Barton Market,Opposite Street to Central Bank Of India"
Singhal Craft Stationers,+(91)-9568082208,0.0,0,"H No. 10, Gali No 1, Gurudwara Road, Modi Nagar, Delhi - 201204, Near Bus Stand"
Hamleys,+(91)-11-45613061,0.0,0,"Reliance Lifestyle Holding Ltd, Unit-28, IGI Airport, Delhi - 110037, SHA Area, Departures, Terminal 1D"
Nihal Trading Co,+(91)-11-25480489,0.0,0,"37 B,Rajindra Park, Friends Enclave, Nangloi, Delhi - 110041, Nr Nangloi Metro Railway Station"
Oak Arts,+(91)-11-46291102,0.0,0,"352, Aggarwal City Plaza, Rohini Sector 3, Delhi - 110085, Mangalam Place"
Sawariya Gift Gallery,+(91)-8800474612,0.0,0,"C-4/18, 0, Keshav Puram, Delhi - 110035, Near Library"
Indian Handicrafts Company,+(91)-11-42754275,5.0,1,"D-1/36, Palam extn., Dwarka Sector 7, Delhi - 110075, Near liberty showroom"
Bablu Thread Ball,+(91)-11-27770711,0.0,0,"5033, Rue Mandi, Sadar Bazar, Sadar Bazar, Delhi - 110006"
Bombay Thread Mill Private ..,+(91)-11-23671972,0.0,0,"35, S T Road, New Delhi, Delhi - 110001"
NAV Rattan Arts,+(91)-11-24357021,5.0,1,"26, Market, Sundar Nagar,, Sundar Nagar, Delhi - 110003"
Global Kreation,+(91)-8860080253,0.0,0,"1798, 3rd Floor, South Extension 1, Delhi - 110049, Giani Bazar, D Block"
Oak Art,+(91)-11-46291102,4.0,3,"P No 6 Khasra No 24, Ignou Rd, Saket, Delhi - 110017"
Krishna Craft Emporium,+(91)-9990183028,0.0,0,"Shop no.2, SHEETLA MATA ROAD, Sector 14, Gurgaon - 122007, NEAR ATUL KATARIYA CHOWK"
TEMPS LIFE STYLE Pvt.ltd.,+(91)-9152958608,0.0,0,"Sco No -123, Huda Market, Gurgaon Sector 46, Gurgaon - 122002"
Arvind Impex Industries Pvt..,+(91)-11-22726192,0.0,0,"R-118, East Vinod Nagar, Delhi - 110091, Near Reliance Fresh"
J Stiles,+(91)-8447528384,0.0,0,"Commercial Complex, Sec 44, Noida - 201301"
Mrignaynee,+(91)-8744012838,0.0,0,"O-3, First Floor, Brahmputra Shopping Complex, Sector 29, Noida - 201303, Main Chowk"
Aman Enterprises,+(91)-8860829086,0.0,0,"add : House Number 1796, Turkman Gate, Delhi - 110006, Near Ramleela Ground & Hazi Manzil, Opposite Phatak Teliyan"
OM Space Build Pvt Ltd,+(91)-9310517480,0.0,0,"6/219, 2nd Floor, Sunder Vihar, Delhi - 110087"
Vidi Leather Craft,+(91)-11-25457128,0.0,0,"E129130, Madipur Colony, Paschim Vihar, Delhi - 110063"
Maa Shakti Art & Craft,+(91)-9871092908,0.0,0,"No A4/404, Paschim Vihar, Delhi - 110063, Near  Jwala Heri Market"
Fabric Connection,+(91)-9999713337,0.0,0,"A43, Phaseii, Budh Vihar, Delhi - 110063"
Marble Glory,+(91)-9210705778,0.0,0,"Dda Colony, Block D, Khayala, Vishnu Garden, Delhi - 110018"
Anas Handicraft,+(91)-9990016188,0.0,0,"Rzh188, Nangloi, Nangloi, Delhi - 110041"
Ahuja Cloths,+(91)-9910174736,0.0,0,"Rzc 118, Nangloi, 50 Feet Road, Nangloi, Delhi - 110041, Opposite Rajendra Public School"
Maavihot Handicrafts,+(91)-9868023817,0.0,0,"Pocket 3, Janta Flats, Paschim Puri, New, Paschim Puri, Delhi - 110063, Near Punjabi Bagh"
Diksha Handicrafts,+(91)-9582896885,0.0,0,"241/1, New, Paschim Puri, Delhi - 110063"
Radha Handicraft,+(91)-9911004448,0.0,0,"A417, Pocket2, Paschim Puri, Delhi - 110063"
Shree Laxmi Narayan Mandir,+(91)-9213137020,0.0,0,"Nilothi, Nilothi, Delhi - 110041"
Ss Exporters,+(91)-9873456015,0.0,0,"B14, Number 28, Block B, Raghubir Nagar, Road, Delhi - 110027"
Varun Enterprises,+(91)-9821252246,0.0,0,"Ba/226, Right Side Shop, Tagore Garden, New, Delhi - 110027"
Khushboo Gift Palace,,0.0,0,"A-30, Peer Baba Road, Nangloi, Delhi - 110041, Shiv Ram Park"
Sani Handicraft,+(91)-9891381498,0.0,0,"A106, New, Shivaji Vihar, Delhi - 110027, Near Tdi Mall"
Multan Aromatic,+(91)-11-25507065,0.0,0,"No.22/7, Chhoti Subji Mandi, New, Janakpuri, Delhi - 110058"
Be-Positive Crafts,+(91)-9211375003,0.0,0,"11/16, 1st Floor, New, Subhash Nagar, Delhi - 110027"
Pious Crafts,+(91)-11-23623024,0.0,0,"73, (Basement), Arihant Nagar, Punjabi Bagh West, Punjabi Bagh West, Delhi - 110026"
Dham Hosiery Works,+(91)-11-41002344,0.0,0,"J-9/48, C, Rajouri Garden, Rajouri Garden, New, Delhi - 110027"
Happy Kids,+(91)-11-25553056,0.0,0,"A-5B/66A, C-2 Block, Janakpuri, Delhi - 110058, Near C2 Bus Stand"
Dhawan Tracer & General Sto..,+(91)-9891241118,4.7,3,"K-30,Main Mkt, Subhash Nagar, Delhi - 110027"
Suresh Rajasthan Rangoli,+(91)-7838939918,0.0,0,"D4, Shop No275, Ground Floor, Sultanpuri, Delhi - 110086"
Kitchen Crafts,+(91)-9212194468,0.0,0,"A2/A6, Janak Puri, New, Delhi - 110058"
Balaji Pvc Doors Wood &craf..;,+(91)-9212842430,0.0,0,"CE-3, Clock Tower, Hari Nagar, Delhi - 110064"
Banawat,+(91)-8376031389,0.0,0,"C4 Block, C St, Chattarpur Enclave, Delhi - 110034"
Neniva Ventures Pvt Ltd,+(91)-9711182868,0.0,0,"Mahindra Park, Rani Bagh, Delhi - 110034"
CHETNA INTIROR CRAFT,+(91)-9810993489,0.0,0,"C-27, Milap Nagar, Uttam Nagar, Delhi - 110059"
Elektrocrafts,+(91)-11-25130967,0.0,0,"103 Cb85b, Ring Road, Delhi - 110064"
Rachna Creations And Hobby ..,+(91)-9818912399,5.0,2,"A-305, Gali Number 15, Rohini Avantika, Delhi - 110085, Near Indian Oil Petrol Pump, A Block, Vijay Vihar, Phase-1"
Rijvan Rajai Wala,+(91)-9899774390,0.0,0,"F2, Vijay Vihar Phase I, Rohini, Delhi - 110085"
Madan Traders,+(91)-9891351796,3.0,2,"D 12/123, Shop No-6, Rohini, Delhi - 110085, Sec-7"
Praz International,+(91)-11-25126053,0.0,0,"B-102f, Mayapuri Industrial Area Phase-Ii, Mayapuri Industrial Area Phase-Ii, New, Delhi - 110064"
Wandcraft Traders,+(91)-7520939291,0.0,0,"Wz 219 Ground Floor, Lajwanti Garden, No. 7, New, Street, Delhi - 110046"
Hari Kripa Creations,+(91)-11-25895898,0.0,0,"I-290, Naraina Vihar, Delhi - 110028, Nr Payal Cinema"
Madan stores,,0.0,0,"Rz-16/3, Manas Kunj Road, Uttam Nagar, Delhi - 110059, Near Kalghi Dhar Gurudwara"
Samshad Rajai,+(91)-8860772335,0.0,0,"Rohini, Rithala, Delhi - 110085, Near Axis Atm"
Green Fabrics,+(91)-9810419097,0.0,0,"Cb235, 1st Floor, Ring Road, Delhi - 110028"
Vhfjgj,+(91)-9971128795,0.0,0,"Shop 2 Pitampura GD block, Pitampura, Delhi - 110088"
Vans Handicraft,+(91)-8285718018,0.0,0,"H.N. /62a, Gali Number 3, Sharma Colony, Budh Vihar Phase Ii, Rohini, Delhi - 110086"
Anushkas Creation,+(91)-8505879696,0.0,0,"We 71 3rd Floor, Mohan Garden Uttam Nagar, Rama Park Road, Delhi - 110059"
Kalra Store,+(91)-11-27863027,1.0,1,"Shop No-20, Prashant Vihar, Delhi - 110085, Blk-B DDA Mkt,Opp Crpf School"
Shavesh Cottan,+(91)-9871393063,0.0,0,"Shop No. Cz 492, Master Banwari Lal Tanwar Marg Village, New, Naraina, Delhi - 110028"
Krafty Fools,+(91)-9999391826,0.0,0,"2740, 13, Ranjit Nagar, Delhi - 110008, Opp Metro Piller 207"
Ashmaya,+(91)-9999651185,0.0,0,"102c, Jhang Society, Plot No. 40, Sector13, Rohini, Delhi - 110085"
Vishal Handloom,+(91)-11-42955878,0.0,0,"Yp Block Market, Pitampura, Delhi - 110034"
Shahi Handicraft,+(91)-9999974126,0.0,0,"2151/10, New Patel Nagar, New, New Patel Nagar, Delhi - 110008, Near Metro Station"
S S Indian Craft,+(91)-11-42720171,0.0,0,"No. 303, 3rd Floor, Sector-4, Plot No. 4, Pankaj Plaza, Dwarka, Delhi - 110075"
Utkarshati Craft,+(91)-9818094293,0.0,0,"93b 2nd floor, Rohini Sector 16, Delhi - 110089, nr sector 15 and sector 16 divider"
Leool Designers Pvt. Ltd.,+(91)-11-45535861,0.0,0,"N-9, Satyawati Nagar, Ashok Vihar, Phase 3 Delhi, Ashok Vihar, Delhi - 110052"
Hindustan Handicraft,+(91)-9818014830,5.0,1,"B-1/321, Sec 17, Rohini, Delhi - 110085, Opposite Govt Mcd School"
Usha Handloom Industry,+(91)-11-27194863,0.0,0,"F1, & F4, Weavers Composite Block, Bunkar Colony, Bharat Nagar, Bharat Nagar, Delhi - 110052, Near Gulabi Bagh"
Utsav Enterprises,+(91)-11-42782970,0.0,0,"House, No A602 U, Sector 7 , New, Dwarka, Delhi - 110075"
Craftex India,+(91)-9356562656,0.0,0,"C-203, Plot No. 7, Sec-10, Dwarka, Delhi - 110075"
Craftazzia,+(91)-9818963360,0.0,0,"S49,2nd Floor,Manish Global Mall, Sec22, Dwarka, Delhi - 110075"
Bhola Handicraft,+(91)-8130559760,0.0,0,"Shop no.- 7a/5, channa market, Karol Bagh, Delhi - 110005, hotel unique"
Alam Handicrafts,+(91)-9810350386,0.0,0,"9824/B Ahata Thakur Dass Sarai, Rohilla Railway Station, New Rohtak, New, Karol Bagh, Delhi - 110005"
Vinayak Handicraft,+(91)-11-65927242,0.0,0,"57, Ist Floor, S S I Industrial Area, Azadpur, Delhi - 110033, Opposite Jahangir Puri Metro Station"
Rajshree Creations,+(91)-9911810354,0.0,0,"Shop No. 2935, Lane No.43, Karol Bagh, New, Beadon Pura, Delhi - 110005"
Ess Kay Fabrics,+(91)-79-25888857,0.0,0,"2967/41, Maharana Pratap Road, Block 12d, Beadonpura, New, Karol Bagh, Delhi - 110005"
Akriti art & craft,+(91)-9971529551,0.0,0,"4/55, Victoria cross building, Karol Bagh, Delhi - 110005, Saraswati marg"
Craft Bazar,+(91)-11-47022817,0.0,0,"Plot No 5/57, Saraswati Marg, Karol Bagh, Delhi - 110005, Near Hotel Clark International"
Eagle Thread Mills,+(91)-11-25796245,0.0,0,"674-A-19, Joshi Road, Karol Bagh, Karol Bagh, Delhi - 110005"
Amit Handy Craft,+(91)-9999292564,0.0,0,"Azadpur, N9b/203, Ashok Vihar, Lal Bagh, Delhi - 110033"
Craft bazar,+(91)-9899298574,0.0,0,"Shop no.18.5/57, Wea saraswati marg, Karol Bagh, Delhi - 110005, Opp.charitable hospital"
Tushar Handloom House,+(91)-11-27674215,0.0,0,"B37, Majlis Park, Majlis Park, Main Road, Delhi - 110033, Near Adarsh Nagar,Opposite Azadpur Subzi Mandi"
Classy Plus,+(91)-8767456456,0.0,0,"B31, Sangam Park, Rana Pratap Bagh, Delhi - 110007"
Manju Overseas,+(91)-9837068829,5.0,1,"25, Gujranwala Town, Delhi - 110033"
Sonu Handloom Fabrrics,+(91)-11-23556553,0.0,0,"9061/21/A, Azad Market, Chowk, New, Ram Bagh Road, Delhi - 110006"
Kripa Handicrafts,+(91)-9818383439,0.0,0,"4418, 1st Floor, Gali Bahuji, Pahari Dhiraj, Sas, New, Sadar Bazar, Delhi - 110006"
Giftland,+(91)-9205200929,0.0,0,Delhi - 110033
Jg Art & Crafts,+(91)-9811615238,0.0,0,"A2/7, Model Town, Delhi - 110009"
Prem Stationery,+(91)-9868617713,0.0,0,"Shop no-B-431, Radha Krishna Mandir Road, Sarup Nagar, Delhi - 110042, Near MCD School"
Lalit Handloom,+(91)-8527586507,0.0,0,"1237,Krishna Mandir Wali Gali, Main Market, Krishna Mandir Wali Gali, Najafgarh, Delhi - 110043, Opposite Niit"
centre point cottege and ha..,+(91)-9911901428,0.0,0,"45, bhagat singh road, Connaught Place, Delhi - 110001, gole market"
Krishna Handicraft,+(91)-7379964994,0.0,0,"Shop no.- 1580, Pahar Ganj, Delhi - 110055, Opp hotel vishal"
All Rozi Fashion Creation,+(91)-11-65638815,0.0,0,"2899/41,2nd Floor,Gupta Market, Near Aggarwal Sweets, Sadar Bazar, Delhi - 110006, Teliwara Chowk"
R P Handicraft.,+(91)-9953844889,0.0,0,"1653., Main bazar., Pahar Ganj, Delhi - 110055, near R k ashram metro."
Rajeev Handi Craft,+(91)-9555157249,0.0,0,"75/3, Chandi Wali Gali, Pahar Ganj, Delhi - 110055"
Zoom Exports,+(91)-9811388118,0.0,0,"5130/7, Behind Amantran Guest  House, Pahar Ganj, Delhi - 110055, Main Bazar Near Amantran Hotel"
The art empire,+(91)-9910208493,0.0,0,"1602, MAIN BAZAR, Pahar Ganj, Delhi - 110055, Near Heritage home hotel"
Mushkan emporium,+(91)-7838197583,0.0,0,"1646, Main market, Pahar Ganj, Delhi - 110055, Near Metropolis hotel"
GoyaL cortage,+(91)-9212521776,0.0,0,"Shop no-9432, Main bazar, Pahar Ganj, Delhi - 110055, Near my bar"
Radhey Krishna Handloom,+(91)-11-23586712,0.0,0,"Shop No-1641, Pahar Ganj, Delhi - 110055, Near R K Ashram Metro Station"
Hare Rama Handloom.,+(91)-9560556078,0.0,0,"1639., Main bazar., Pahar Ganj, Delhi - 110055, Near metro polish hotel."
Jk handicraft,+(91)-9210909270,0.0,0,"1710, China mandi, Pahar Ganj, Delhi - 110055, near rk metro station"
Wooddy People,+(91)-9112345671,0.0,0,"1524, Main Market, 3rd Floor, Pahar Ganj, Delhi - 110055, Near Rk Ashram Marg Metro Station"
S R Handicraft,+(91)-9455830540,0.0,0,"5178, MAIN BAZAR, Pahar Ganj, Delhi - 110055, Near metro polis hotel"
Kissan Khadi Bhandar,+(91)-9891010546,0.0,0,"Shop No 881 Basement Wala Showroomstreet, Khadi Bhandar Bazaar, Nawada Bazar, Najafgarh, Delhi - 110043"
Dua Handicrafts,+(91)-9811175397,0.0,0,"4968, Maharaja Agarsain Marg, Sadar Bazaar, New, Rui Mandi, Delhi - 110006"
Alishan Expo,+(91)-9911114496,0.0,0,"Shop no.-5140, Main bazar, Pahar Ganj, Delhi - 110055, Near hotel metropolise"
Antique Craft Deluxe India.,+(91)-11-65371674,0.0,0,"Shop No- 5134, Main Bazar., Pahar Ganj, Delhi - 110055, Near Subway -eat Fresh"
Heart of stone,+(91)-11-23582387,0.0,0,"5133, Main Bazaar, Pahar Ganj, Delhi - 110055, Below Hotel Sapna"
Capital Thread House,+(91)-11-23627589,0.0,0,"5731, Gandhi Market, Sadar Bazar,, Sadar Bazar, Delhi - 110006"
Madhu Thread Works,+(91)-11-23537459,0.0,0,"2836,, Partap Market, Sadar Bazar, Sadar Bazar, Delhi - 110006"
Som Handicrafts,+(91)-11-65250722,0.0,0,"5698, Gandhi Market, Sadar Bazaar, Sadar Bazar, Rui Mandi, Sadar Bazaar, New, Chandni Chowk, Delhi - 110006"
Ethnic Arts,+(91)-8588915732,0.0,0,"5128, Main Bazaar, Pahar Ganj, Delhi - 110055, Near My Bar"
SK Handicraft.,+(91)-7503839062,0.0,0,"Shop no.- 5280., main bazar,, Pahar Ganj, Delhi - 110055, near R.K ASRAM metro station"
Parkash Threads And Polytex..,+(91)-11-27771339,0.0,0,"5405/A-1, Partap Market, Sadar Bazar, Sadar Bazar, Delhi - 110006"
Crystal Emporium,+(91)-11-23561211,0.0,0,"5118, Gali Thanedar Wali, Pahar Ganj, Delhi - 110055, Main Bzr,Nr Prince Palace Hotel"
Iron Craft.,+(91)-7503662348,3.8,9,"Shop No-5., Panchkuian Road,, New Delhi, Delhi - 110001, Near Rama Krishna Metro Station,"
Neha Export House,+(91)-11-23584693,4.0,2,"5081,, Main bazar, Pahar Ganj, Delhi - 110055, Opposite Khanna Cinema Hall"
Prime Cargo Exports,+(91)-11-32318572,0.0,0,"Shop no-1574, Main bazar, Pahar Ganj, Delhi - 110055, Near vishal hotel"
Alishan Expo,+(91)-8505888686,0.0,0,"Shop no.- 5140, Main bazar, Pahar Ganj, Delhi - 110055, Near r k ashram metro"
Delhi Bazaar Craft House,+(91)-11-41515250,0.0,0,"International Departure Terminal 3 (T3), Indira Gandhi International Airport, Delhi Bazaar Craft Hou, Delhi - 110037"
Elegant Arts,+(91)-9560202522,0.0,0,"5072, Main Bazar, Pahar Ganj, Delhi - 110055, Near SAMs bar"
Ranjeet Handicrafts,+(91)-9999727812,0.0,0,"T-298,Shop No 4,Hare Rama Guest House,Main Bazar ,Green Market, General market, Pahar Ganj, Delhi - 110055, Near Khanna Cinema and vivak hotel"
kash craft,+(91)-8800312202,0.0,0,"5060 main bazar, Pahar Ganj, Delhi - 110055, near vivek hotel"
A M Handicrafts,+(91)-9811415139,0.0,0,"5064, Main bazar, Pahar Ganj, Delhi - 110055, Opp vivak hotel Near kahna cinema"
Om Fashion,+(91)-9654899521,0.0,0,"5060, General market, Pahar Ganj, Delhi - 110055, Opp Vivek Hotel and Rama. Krishna metro station"
Sobti International,+(91)-11-23589071,3.7,3,"Shop No-40, Pahar Ganj, Delhi - 110055, Near New Delhi Railway Station"
Lovely Handicrafts,+(91)-11-23580016,4.0,1,"Shop no.4795, Main bazar, Pahar Ganj, Delhi - 110055, Six Tooti Chowk"
Jai Chanday Pir Handicraft.,+(91)-9891443488,0.0,0,"1139., MAIN BAZAR., Pahar Ganj, Delhi - 110055, Opposite hotel all is well."
Laxmi jewellery,+(91)-9716761909,5.0,1,"1102-a, Main bazar, Pahar Ganj, Delhi - 110055, Near chandni wali gali"
Indian Handicraft Jewellery,+(91)-9999202535,0.0,0,"1080, Main bazar, Pahar Ganj, Delhi - 110055, Near new delhi railway station"
Mousumi Handicraft,+(91)-9717043357,0.0,0,"Rz 31, Z Block, Shyam Vihar, Phase 1, Najafgarh, Delhi - 110043"
Bhawana Thread House,+(91)-11-27769624,0.0,0,"23684/86,, Multani Dhanda, Pahar Ganj, Pahar Ganj, Delhi - 110055"
Natural Textile Collection,+(91)-7834993553,0.0,0,"Mezzanine Floor, C/O Panthoibi Manipur Emporium, C7 Baba Kharag Singh Marg, Delhi - 110001"
Rajdhani  Handicrafts,+(91)-9312386083,5.0,1,"4550, Main bazar, Pahar Ganj, Delhi - 110055, Near railway station"
Indian Handicraft Bazar,+(91)-11-41698840,0.0,0,"1887/A, Chuna Mandi, Pahar Ganj, Delhi - 110055"
H I Handicrafts,+(91)-9582388504,0.0,0,"979, 2nd Floor, Gali Rajan, Farash Khana, Delhi - 110006"
Malhotra Handloom,+(91)-11-55334520,0.0,0,"4659, Mahavir Bazar, Cloth Market, Shajahanabad, Katra Ghel, Old Delhi, New, Khari Baoli, Delhi - 110006"
Handloom Shop,+(91)-9001954469,0.0,0,"660, Church Mission Road, Katra Ghel, Fatehpuri, New, Chandni Chowk, Delhi - 110006"
Handicraft Of India,+(91)-11-34215462,3.0,1,"45, A1-Block Extenstion, Sant Nagar, Delhi - 110084, Opposite Police Station, Near APEX Hospital"
Indian Handicrafts Manufact..,+(91)-9716004990,0.0,0,"405, Kucha Brij Nath, Chandni Chowk, Delhi - 110006"
Shilpi Lace & Fabrics,+(91)-9810768420,0.0,0,"4958/5, 1st Floor, Main, Sadar Bazaar, Sadar Bazaar, New, Delhi - 110006"
Wood Craft Creatives,+(91)-9213948359,0.0,0,"D 15 Rajiv Park, West Shagerpur, New, Chandni Chowk, Delhi - 110006"
Aster International,+(91)-11-23278116,0.0,0,"2085, Turkman Gate, Ajmere Gate, New, Delhi - 110002, Behind Asaf Ali Road"
Flamingo India,+(91)-11-25742220,0.0,0,"16-B/4, Poorvi Marg, Old Rajinder Nagar, New Delhi, Delhi - 110001"
Master Stroke Interiors Pri..,+(91)-11-26859281,0.0,0,"A-68, Freedom Fighters Enclave, Neb Sarai,, New Delhi, Delhi - 110001"
BEE Gee Handicrafts,+(91)-11-25680496,0.0,0,"27, Phase-I, Udyog Vihar,, New Delhi, Delhi - 110001"
Golden Thread Industries,+(91)-11-25413887,0.0,0,"313/71, Anand Nagar, New Delhi, Delhi - 110001"
Laxmi Threads,+(91)-11-27522927,0.0,0,"B-2925, Garh Road, New Delhi, Delhi - 110001"
Prakash Thread Ball Factory,+(91)-11-27775248,0.0,0,"312, Main Sadar Bazar, New Delhi, Delhi - 110001"
S S Collection,+(91)-11-23876797,0.0,0,"2091/21, Bhagirath Palace, Delhi - 110006, Bajrang Bazar, Chah Indara"
Golden Thread Private Limit..,+(91)-9810002979,0.0,0,"256, Okhla Industrial Estate, New Delhi, Delhi - 110001"
Embroidery,+(91)-11-22324797,0.0,0,"L-2, Sidh Apartments, Plot No.107, I P Extension, New Delhi, Delhi - 110001"
N R Handicrafts,+(91)-11-29541000,0.0,0,"C-106, Pancheel Vihar, Malviya Nagar, Malviya Nagar, New, Delhi - 110001"
Wintex Craft,+(91)-9818332586,0.0,0,"B771, Netaji Nagar, New, Sarojini Nagar, Delhi - 110023"
Cheap Handloom House,+(91)-11-23919681,0.0,0,"16, Krishna Market, New, Chandni Chowk, Delhi - 110006"
Montu Bhai Sons Kinar Wale,+(91)-9818606521,0.0,0,"Shop No.2818, Kinari Bazar Road, Dharam Pura, New, Chandni Chowk, Delhi - 110006"
Rana beads centre,+(91)-11-23288504,3.5,2,"2948, Chandni Chowk, Delhi - 110006, Katra Khushal RAI,Kinari Bzr"
Parsvnath Fabrics,+(91)-11-20319482,0.0,0,"1350, Katra Lehswan, Chandani Chowk, New, Chandni Chowk, Delhi - 110006"
Sami Crafts,+(91)-11-23280403,0.0,0,"Shop No. 2084, Bulbuli Khana, Turkman Gate, Delhi - 110006, Near Kala Masjid"
Prianjli Traders,+(91)-9210004096,0.0,0,"Kinari Bazar Road, Dharam Pura, New, Chandni Chowk, Delhi - 110006"
Avneet Art,+(91)-9313308299,0.0,0,"1202a, 1st Floor, Chah Rahat, Jama Masjid Road, Vakil Pura, New, Chandni Chowk, Delhi - 110006"
Vardhman Handicrafts,+(91)-9811442849,0.0,0,"House No.1303, Vakilpura, Gali Guliyan, Delhi - 110006, Near Jama Masjid"
R K Yogeshver,+(91)-9810781677,0.0,0,"Vakil Pura, New, Bazar Gulian Road, Chandni Chowk, Delhi - 110006"
Lhamo Tibetan Shops,+(91)-9811033057,0.0,0,"House, 196, Shop # 6, Samyeling Tibetan Colony, Majnu Ka Tilla, Majnu Ka Tilla, Delhi - 110054"
Lal & Sons Shoes Rack,+(91)-11-23239006,0.0,0,"Shop No 3033, Asaf Ali Road, Delhi - 110002, Near Darya Ganj"
Liverty Handicrafts,+(91)-9213232164,0.0,0,"1872, Handicrafts Mkt, Darya Ganj, Muhammad Deen Ilachi Marg, Phatak Teliyan, Kalyanpura, Old Delhi,, Turkman Gate, Delhi - 110006"
Nepal Arts,+(91)-9990671066,0.0,0,"Jama Masjid Road, Hippy Wada, New, Chandni Chowk, Delhi - 110006"
Aslam & Sons,+(91)-9899913096,0.0,0,"3026, Kalan Masjid, Main Road, Turkman Gate, Delhi - 110006"
Afzal Handicrafts,+(91)-9818810340,0.0,0,"1591, Gali Chandi, Sita Ram Bazar, New, Chandni Chowk, Delhi - 110006"
Sanjeev Art,+(91)-11-25596804,0.0,0,"1251,, Jama Masjid, Jama Masjid, Delhi - 110006, Chahrahat"
Hind Handicrafts,+(91)-9211319867,0.0,0,"2974, Kalan Masjid, Darya Ganj, Phatak Teliyan, Ahata Mir Bukhari, Turkman Gate, Delhi - 110006"
Krishnayan,+(91)-9810283743,0.0,0,"5, Kg Marg, Mandi House, New, Vakil Lane, Mandi House, Delhi - 110001"
